{
  "schema_version": 1,
  "review_id": "rev_stage1smoke",
  "generated_at": "2026-04-17T21:00:00Z",
  "review_started_at": "2026-04-17T21:00:00Z",
  "reviewed_sha": "abcdef0123456789",
  "base_branch": "main",
  "head_branch": "feature/stage1-smoke",
  "mode": "local",
  "pr_state": null,
  "pr_number": null,
  "comment_id": null,
  "trivial_mode": false,
  "reviewer_sources": ["detection"],
  "reviewed_files_all": [
    "src/auth/session.ts",
    "src/billing/invoice.ts",
    "src/api/search.ts",
    "src/components/DeleteButton.tsx",
    "src/models/user.ts",
    "src/models/preferences.ts"
  ],
  "claude_md_paths": [],
  "findings": [
    {
      "id": "F001",
      "sources": ["detection"],
      "source_families": ["code-review"],
      "impact_type": "correctness",
      "origin": "introduced_by_pr",
      "origin_confidence": "high",
      "actionability": "auto_fixable",
      "validation_lane": "deep",
      "current_state": "open",
      "disposition": "confirmed_auto",
      "is_actionable": true,
      "reason": null,
      "confirmed_strength": "strong",
      "file": "src/auth/session.ts",
      "line_range": [42, 58],
      "claim": "Null leak to callers assuming non-null",
      "score_phase3": 85,
      "score_phase4": null,
      "score_history": [{"phase": "phase_3", "score": 85}],
      "validation_result": null,
      "fix_attempts": [],
      "introduced_in_sha": null,
      "suggested_follow_up": null,
      "related_parent_finding_id": null
    },
    {
      "id": "F002",
      "sources": ["detection"],
      "source_families": ["code-review"],
      "impact_type": "correctness",
      "origin": "introduced_by_pr",
      "origin_confidence": "high",
      "actionability": "manual",
      "validation_lane": "deep",
      "current_state": "open",
      "disposition": "confirmed_manual",
      "is_actionable": false,
      "reason": "design decision; needs product input",
      "confirmed_strength": "moderate",
      "file": "src/billing/invoice.ts",
      "line_range": [55, 80],
      "claim": "Partial-refund branch incomplete",
      "score_phase3": 78,
      "score_phase4": 78,
      "score_history": [
        {"phase": "phase_3", "score": 78},
        {"phase": "phase_4", "score": 78}
      ],
      "validation_result": null,
      "fix_attempts": [],
      "introduced_in_sha": null,
      "suggested_follow_up": null,
      "related_parent_finding_id": null
    },
    {
      "id": "F003",
      "sources": ["detection"],
      "source_families": ["code-review"],
      "impact_type": "correctness",
      "origin": "introduced_by_pr",
      "origin_confidence": "medium",
      "actionability": "auto_fixable",
      "validation_lane": "deep",
      "current_state": "open",
      "disposition": "uncertain",
      "is_actionable": false,
      "reason": null,
      "confirmed_strength": null,
      "file": "src/api/search.ts",
      "line_range": [33, 33],
      "claim": "Query string possibly not escaped",
      "score_phase3": 55,
      "score_phase4": 55,
      "score_history": [
        {"phase": "phase_3", "score": 55},
        {"phase": "phase_4", "score": 55}
      ],
      "validation_result": null,
      "fix_attempts": [],
      "introduced_in_sha": null,
      "suggested_follow_up": null,
      "related_parent_finding_id": null
    },
    {
      "id": "F004",
      "sources": ["detection"],
      "source_families": ["code-review"],
      "impact_type": "ux",
      "origin": "introduced_by_pr",
      "origin_confidence": "high",
      "actionability": "auto_fixable",
      "validation_lane": "light",
      "current_state": "open",
      "disposition": "confirmed_auto",
      "is_actionable": true,
      "reason": null,
      "confirmed_strength": "moderate",
      "file": "src/components/DeleteButton.tsx",
      "line_range": [12, 12],
      "claim": "Missing loading state on destructive action",
      "score_phase3": 60,
      "score_phase4": 60,
      "score_history": [
        {"phase": "phase_3", "score": 60},
        {"phase": "phase_4", "score": 60}
      ],
      "validation_result": null,
      "fix_attempts": [],
      "introduced_in_sha": null,
      "suggested_follow_up": null,
      "related_parent_finding_id": null
    },
    {
      "id": "F005",
      "sources": ["detection"],
      "source_families": ["code-review"],
      "impact_type": "correctness",
      "origin": "pre_existing",
      "origin_confidence": "high",
      "actionability": "report_only",
      "validation_lane": "deep",
      "current_state": "open",
      "disposition": "pre_existing_report",
      "is_actionable": false,
      "reason": null,
      "confirmed_strength": null,
      "file": "src/models/user.ts",
      "line_range": [12, 12],
      "claim": "No index on `email`",
      "score_phase3": 70,
      "score_phase4": 70,
      "score_history": [
        {"phase": "phase_3", "score": 70},
        {"phase": "phase_4", "score": 70}
      ],
      "validation_result": null,
      "fix_attempts": [],
      "introduced_in_sha": null,
      "suggested_follow_up": "File as separate issue",
      "related_parent_finding_id": null
    },
    {
      "id": "F006",
      "sources": ["detection"],
      "source_families": ["code-review"],
      "impact_type": "architecture",
      "origin": "introduced_by_pr",
      "origin_confidence": "medium",
      "actionability": "manual",
      "validation_lane": "light",
      "current_state": "open",
      "disposition": "uncertain",
      "is_actionable": false,
      "reason": "uncertain (Phase 4 inconclusive)",
      "confirmed_strength": null,
      "file": "src/models/preferences.ts",
      "line_range": [15, 22],
      "claim": "Deprecated pattern used in new code path",
      "score_phase3": 50,
      "score_phase4": 48,
      "score_history": [
        {"phase": "phase_3", "score": 50},
        {"phase": "phase_4", "score": 48}
      ],
      "validation_result": null,
      "fix_attempts": [],
      "introduced_in_sha": null,
      "suggested_follow_up": null,
      "related_parent_finding_id": null
    }
  ],
  "cross_cutting_groups": [],
  "subagent_tokens": {
    "total": 12000,
    "invocations": 8,
    "by_phase": {},
    "by_model": {},
    "by_lens": {},
    "by_finding_phase4": {}
  },
  "metrics": {
    "phase_9_verified_pct": null,
    "required_followup": null,
    "time_elapsed_seconds": null,
    "pr_size_buckets": {
      "files_changed": 5,
      "lines_changed": 200
    }
  }
}
